keyword,title,score,comments,date,text,url
Microtransaction,MH Wilds - Bad performance mystery (Solved?),8477,1265,2026-01-15,"**🟢 Quick update after the patch: I’ve already checked more than half of what I dug into back then, and I can say they addressed everything I reported to them directly (*****at least as of now, based on what I’ve had time to verify so far*****).**  **And obviously, they’ve also optimized a lot of other aspects of the engine as well. On a more subjective note, and without hiding how happy I am, I can confidently say they did a damn good job overall!**  \------------------  **❗️** *CAPCOM REPLIED - THEY’RE ALREADY LOOKING INTO IT AND IT WILL BE FIXED. FROM WHAT I UNDERSTAND FROM THEIR RESPONSE, THEY’LL BE ADDRESSING THE WHOLE DLC-CHECKING LOGIC: HUBS, AND POSSIBLY (??) MORE THAN THAT, IF (!!) IT AFFECTS OTHER PARTS OF THE GAME TOO.* **❗️**  **# LATE DISCLAIMER** (*sadly I have to add this almost a day after posting*).  Guys, what I thought would be just a *normal* post with my personal observations kinda snowballed like crazy. A lot of websites took my words out of context and basically twisted them. And many players saw in my post only what they wanted to see.  So please, read the whole thing from start to finish and dont jump to conclusions. Take a minute and actually look at what I was trying to say.  And the most important part: I was talking about the FPS problem mostly **in hubs**. All of my testing was done **in hubs**, even on the video, because the original problem (*for me*) was hubs. This is mentioned in the post **6 (!!!) times**. Yes, I mentioned in comments that I noticed slightly smoother performance in some other places too, but that still needs very serious, exhausting testing, and it will take quite a lot of time.  I will keep investigating performance in general, but for now this is confirmed like 99% **specifically in hubs**. And yeah, in this specific case, we can joke about Capcom all day, **but this wasn’t intentional from their side - it’s just a bug in the code**. Treating it seriously as some deliberate move makes no sense from any marketing ",https://www.reddit.com/r/MonsterHunter/comments/1qcy3hn/mh_wilds_bad_performance_mystery_solved/
Druid,"If I chant ""DRACTHYR DRUIDS"" loud enough, do you think Blizzard will listen..?",2456,2258,2026-01-15,,https://i.redd.it/js80ti04oddg1.png
Patch,ELDEN RING NIGHTREIGN – Patch Notes Version 1.03.2,2139,942,2026-01-15,PATCH NOTES!!!!!!! 🎉🎉🎉,https://en.bandainamcoent.eu/elden-ring/news/elden-ring-nightreign-patch-notes-version-1032
Lag,Jet Lag Ep 5 — Searching Highlands &amp; Lowlands,234,454,2026-01-15,,https://nebula.tv/videos/jetlag-s16e5
Paladin,Paladin spec,4,12,2026-01-15,Which spec should I play while leveling? I created a blood elf I am currently level 8 and wondering the best spec to play during pre patch for paladin,https://www.reddit.com/r/classicwowtbc/comments/1qdjf67/paladin_spec/
Spiritborn,Question about my Quill Volley Spiritborn,1,5,2026-01-15,"Hi all,  I am using this guide from maxroll: [Quill Volley Spiritborn Endgame Build Guide - D4 Maxroll.gg](https://maxroll.gg/d4/build-guides/quill-volley-spiritborn-guide#paragon-glyphs-header)  I switched to the 'ancestral build' because i have the necessary uniques: rod of kepeleke and ring of the midnight sun. I also have  the hesha e kesungi and the harmony of ebewaka.  I dont have full vigor at all when casting Quill Volley, probably because the rest of my gear is really mediocre (not ancestral and hardly the right rolls).  Should i switch back to the 'starter build' until my gear is atleast ancestral and with uniques that have better rolls than what i have now? With the combination of the mediocre rolled uniques and legendaries i also feel quite squishy so i might be better of using a helm for example with more defensive stats.",https://www.reddit.com/r/diablo4/comments/1qcwpr4/question_about_my_quill_volley_spiritborn/
Paladin,Not enough level 58 paladins,1782,377,2026-01-15,,https://i.redd.it/4uun3jaqqddg1.png
Barbarian,[BARBARIAN] [INTIMIDATION] ROAR!,1906,66,2026-01-15,"Meet Ghorza, my Half-Orc Barbarian/Fighter Tav.",https://www.reddit.com/gallery/1qcxhis
Competitor,"Google in 2019 patented the Transformer architecture(the basis of modern neural networks), but did not enforce the patent, allowing competitors (like OpenAI) to build an entire industry worth trillions of dollars on it",1233,133,2026-01-15,,https://i.redd.it/jcdnq7pqncdg1.png
Price,If America invades Greenland the stock market will pay the price,2748,1207,2026-01-15,"Any military action against Greenland immediately escalates into a transatlantic crisis. At best, the U.S. would face sweeping sanctions from the EU and allied economies. At worst, it could spark an armed conflict between NATO members, something the global financial system is absolutely not built to handle.  Markets hate uncertainty, and this would be uncertainty on a historic scale. Trade between the U.S. and Europe would likely be disrupted or frozen, shipping lanes in the North Atlantic and Arctic would be militarized, and global supply chains would seize up almost overnight. Energy prices would spike, markets would panic, and investor confidence would evaporate.  The U.S. economy is especially vulnerable here because it’s heavily dependent on globalized, high tech supply chains. Semiconductors, rare earth processing, advanced manufacturing none of these exist in isolation. If relations with Europe and allied nations collapse, access to critical components and materials would be severely constrained. A tech-driven economy can’t function if it can’t get chips, equipment, or precision manufacturing machinery.  Beyond the immediate economic damage, the long-term consequences would be even worse: capital flight from U.S. markets, a weakened dollar, and a permanent loss of trust in America as a stable anchor of the global system. A move like this won't just be a geopolitical mistake; it would be economic turmoil on a scale we haven't seen in a long time.",https://www.reddit.com/r/stocks/comments/1qdd0iu/if_america_invades_greenland_the_stock_market/
Necromancer,"With classes getting reworked, will Necromancer FEELlike a Necromancer?",52,68,2026-01-15,"It seems like their rework idea for the Necromancer is to make him a summoner and actual undead commander, based in their roadmap of reworks and class fantasies. My question is this: Will it actually feel like an army commanding summoner, or will it fall flat and still have just 3 summons and have none be permanent or even actually commandable? My thoughts...are that it will either feel like a summoner of the dead and get nerfed to shit, or feel just as underwhelming and have even Diablo IV stomp it in the Necromancer feel department.",https://www.reddit.com/r/elderscrollsonline/comments/1qctlld/with_classes_getting_reworked_will_necromancer/
PTR,"Heroes of the Storm PTR Patch Notes - January 14, 2026",574,505,2026-01-15,,https://news.blizzard.com/en-us/article/24245220/heroes-of-the-storm-ptr-patch-notes-january-14-2026
Loot,What items are you often running out/in need of that you can't seem to loot enough of?,2706,930,2026-01-15,"Mine is mechanical components to level up my guns. I rarely find many. I know to farm Metal and Rubber Parts to craft them but I still seem to run low.  Second is heavy metal parts, I can't seem to find enough of them and holds my upgrades back..  I combat that with running a few free loadouts to top everything up or buying more than I need from the shop and try keeping a stock when they replenish.  Any tips to share?",https://i.redd.it/p6zf9g3mghdg1.png
Loot,Games with good loot systems?,13,15,2026-01-15,"I like games where loot matters, like ARPGS.  I recently tried ""Overlooted"" but the items for me seems very generic or un-specific.  I want a game where I can find a very rare weapon or item by grinding, similar to ARPG's like Diablo or Path of Exile.  Could you give me good suggestions? No more ARPG's.",https://www.reddit.com/r/gamingsuggestions/comments/1qdho4v/games_with_good_loot_systems/
Spiritborn,evade spiritborn advice,2,4,2026-01-15,"Hello guys, i have two Wushke Nak Pa, can u give me advice, what is better for evade spiritborn build ? Thanks (Y)  https://preview.redd.it/861qznd1ahdg1.png?width=1047&amp;format=png&amp;auto=webp&amp;s=18ce5759e72a2e05a49e818ef14a323ac1852250  ",https://www.reddit.com/r/d4spiritborn/comments/1qdenjr/evade_spiritborn_advice/
PTR,"In the unlikely event, that deathwing gets his quest done. It instantly takes out a fort (PTR)",534,91,2026-01-15,Just incase you didn't read the title. This is a new thing on ptr. and to stack the quest its really hard  you get 1 stack every tick on an enemy player in your fire breath. Every kill with the fire breath gives 50. You need 2000. So 40 kills. or roughly 500 seconds (4 ticks per seocnd),https://v.redd.it/wfz8146ztddg1
Buff,How substantial are the Traveler’s buffs post AQ?,48,21,2026-01-15,,https://v.redd.it/hhdn5c9mxbdg1
Disconnect,Anyone else getting disconnects often?,6,2,2026-01-15,"This happens to me frequently, typically early in the match the game will disconnect with both of us actively playing. If I’m winning I get the win, draw, loss etc. The game ends as if the opponent had forfeited despite them playing and the ball being in play. ",https://www.reddit.com/r/EASportsFC/comments/1qdf9b4/anyone_else_getting_disconnects_often/
Battle Pass,Battlepass rewards are getting lower,2,5,2026-01-15,"I've been playing League of Legends since 6 years almost, I remember when I played the old Battle passes and I have good memories, even if I could complete the oke with prestige Voli. My first full bp was in sentinel event.  Lately i've been playing by seasons, and just came again after a half year break just in the past bp, I felt a bit bad seeing my only choice was picking the Zoe prestige skin, but at least I tough 50 ME were great  But now in this bp I see that there's only 25 ME, even if you get ME in chests, you'll almost take 6 entire seasons to buy a new prestige. What happend to the old bp that at least let you chose ME instead of the prestige if you dont like it? Why is the bp full of blue essence, dont get me wrong, as a new player its good to buy more champs ofc, but for old ones its just savings for Emporium.   Idk, I just feel its not worth at all to play to complete the pass, and thats something that at least kept me in the game when I played.",https://www.reddit.com/r/leagueoflegends/comments/1qd6722/battlepass_rewards_are_getting_lower/
Lag,You can greatly reduce lag on servers by doing this.,6,6,2026-01-15,"Lower your view distance ingame in the settings. The default is around 512. I was struggling with rubberbanding and incredible lag. After lowering my view distance to 320, performance MASSIVELY improved. If 320 is still bad for you then a nice 256 should be fine. Just lower it from 512 because holy moly I don't need to see that far away.",https://www.reddit.com/r/hytale/comments/1qcsuk0/you_can_greatly_reduce_lag_on_servers_by_doing/
Competitor,"Realized my ""regular customer"" has been a competitor doing market research",1539,259,2026-01-15,"I run a small commercial cleaning service in Phoenix, about 8 employees. Back in September this guy starts booking us for small jobs, maybe twice a month, always different locations. Nice enough dude, asks a TON of questions though. Like what products we use, how we price square footage, what our turnaround times are, stuff like that. I figured he was just one of those detail oriented clients.  Recently I'm at a local business networking thing and someone mentions they just hired a new cleaning company. I ask who and its literally this same guy. Turns out hes been running his own cleaning business the whole time, just started it in August. All those ""jobs"" he hired us for were him basically taking notes on our entire operation.  He even asked me once about our employee retention and I told him we give small bonuses when we hit quarterly goals because it keeps people motivated. Now Im wondering if he copied that too. The whole thing has me stressed and Im glad I at least have some money saved aside from Stаke personally because I might need to pivot some things if he starts undercutting us.  Part of me wants to be annoyed but I dont know if I can even do anything about it? Like he technically paid for services so its not illegal or anything. But it feels shady as hell. Should I just let it go or is there something Im supposed to do here?",https://www.reddit.com/r/smallbusiness/comments/1qd0vlb/realized_my_regular_customer_has_been_a/
Necromancer,I really need to see what a relentlessly gay yard looks like.,44908,1236,2026-01-14,,https://i.redd.it/6kpjp9m1sbdg1.png
Loot,Loot situation PVE [Discussion],30,99,2026-01-14,"I will start this off with saying, YES i know pve is alot lot easier than PVP and YES i know the loot got nerfed twice and the loot was really op on start of wipe. But now.. I wanna know if anyone is experiencing the same thing. Cutlists. Been farming them for a quest for knives and before the 2nd nerf I got a marked room key or smthing valuable. NOW? I have killed them 3 times today. 12 cultists and 3 priests. I get a diary 3 times. Is this just RNG or is the loot for cultists tanked too?  Don't get me started with marked rooms or keycards on labs. I will be lucky to even get 3-5 stims out of green card. Dorms 314 I get ak and a Cat statue. I did dorms 314 10 i got 1 keycard and it was a yellow one that sells for less than 1mill. So you are telling me you pay 20mill for less than 4million return. Blue folders? Never seen them in my life. Checked every spawn.   To be honest. I don't really care about valuable loot that much ATLEAST give tons of shit items instead of 2 items worth less than 100k in a 2million marked room opening.   Does anyone have any tips to hitting 200million? Cause I am lost now. Nothing seems profitable to any degree besides labyrinth but that isnt even that good anymore either... Please give any suggestions \^ I am just lost at what to do since I am fairly new to tarkov. Labyrinth I run alot. But i barely make 1 million for risking everything.     Just to end this, I am not complaining in any way shape or form. PVE should have less loot than PVP to a quite big degree. But I think this is a bit of a stretch how far loot has gone down. I will keep playing regardless but holy is it bad. IMO marked rooms should be less than 2million at this point.",https://www.reddit.com/r/EscapefromTarkov/comments/1qc3ekg/loot_situation_pve_discussion/
Loot,"Most Overrated ""High Loot Value"" Area in the Game",7245,1008,2026-01-14,Change my mind. Never anything worth a spit in this place. I could pass by it 15 minutes in a Night Raid and it's still unopened. ,https://i.redd.it/9g5mzl3p87dg1.png
Barbarian,Guess the Romans were considered barbarians in the eyes of the Greeks,2851,87,2026-01-14,,https://i.redd.it/khh32y53b8dg1.jpeg
Battle Pass,New legendary venom skin for season 6 battle pass,1403,321,2026-01-14,,https://i.redd.it/9c9b9225d6dg1.jpeg
Buff,Revenant Buff Is Finally Here,1470,451,2026-01-14,Surely.... ,https://i.redd.it/gq37kzelebdg1.jpeg
Necromancer,"Tired of today's ""necromancers""",572,104,2026-01-14,"I'm really tired of looking at my crystal and see everyone calling themselves a ""necromancer"" this days. It's all over the place! They think they're being cool but they're NOT!  I mean, I'm not into necromancy myself but when I used to lick fairy dust to disconnect myself from my studies I always went looking for a fight with one. It used to be really fun, they had very powerful armies and many backup plans that always made me jump out of my robe from surprise.  Now most of them are weak. Really, these people need to go to a graveyard, dig villager A, villager B and villager C themselves and then make a pact with a fucking demon just to make some bodies stand up and wander aimlessly. They can't even command them!!! And if they're caught they just run like cowards because they're deathly afraid of the inquisition and can't cast any magic to eliminate the witness or to defend themselves. And then they blame their failures on the lack of good corpses lmao  Back in my fighting days necromancers created ego from their own spite to animate the dead by their own means. They had HUGE armies full of lichs, death knights and other powerful, skilled, smart but obedient undeads. And even then they had many other spell in their arsenal to support their armies of kill powerful people for fresh undead soldiers. They could instantly cast things like ""Interdimensional binding tentacles"", ""Soul execution"" and ""Fatberg rain"".  They never complained about not finding fitting bodies because they could kill anything themselves and then make then their undead. They were skilled even in fusing bodies. Example: once I fought a necromancer that made a dullahan so insanely poweful that it could cut through space with sheer force! My multilayered barrier almost didn't resist that! I managed to get rid of the dullahan and the necromancer but the dude somehow revived himself into a lich and came after me in under a month with a big ass undead army. After that I killed him three other times and I",https://i.redd.it/hn6e1wn1o7dg1.png
Competitor,9070XT + 9060XT + 9800x3D. Ultimate 5090 competitor.,0,20,2026-01-14,"9800x3D + 9070 XT + 9060 XT build. Double PCI 5.0 x8x8. Lossless Scaling and AFMF can be used on second GPU and, with no effort, double the FPS.  There's no need to buy a 9060XT and a B580, a 7600XT or even a 6600XT would work, but due to a good price on a specific retail and overpriced second hand market, using two same generation GPUs it's all pros.  Still, both GPUs together, can be bought for less than 1000€, so you don't even get into 5080 territory.  Don't bully me for saying it's a 5090 competitor, I'm just using Nvidia's marketing strategy. Even so, frame generation with a dual GPU has much lower latency than any Nvidia or AMD single GPU fg technology.",https://i.redd.it/o6b22n5l85dg1.png
Rogue,Fully modular Rogue Trader interior for my W40K RPG,6510,187,2026-01-14,"After 4 months of hard work and a 3D printer that has been running non-stop, I’ve finally finished this project that I’ve wanted to complete for a long time.  All elements (pillars, walls, floors) are modular, 3D printed, and hand-painted.  Here are a few stats for those who are interested:  * 1,864 terrain pieces (around 1,400 for the terrain shown in the photo) * 170 hours of painting * 26 kg of PLA (\~400 €) * \~200 € worth of Citadel paints (if I had to do it again, I’d buy cheap acrylic paint in large quantities haha)  For the 3D models:  * **“Gothic Sector: Lost Ships”** by FabricatorLairs for the floors, walls, etc., with a few parts I modeled myself for greater versatility. * **Machinery Pack – Scatter Terrain (2nd Dynasty)** for the engine room. * **Bleak Bathroom Scatter Terrain** (MadRamDesigns) for the urinals. * **Industrial Scatter Terrain Set** (Printaboy) for some cargo ship elements.",https://www.reddit.com/gallery/1qbz664
Rogue,"'ICE Has Gone Rogue': Khanna Demands Arrest, Prosecution of Jonathan Ross for Murder of Renee Good",7824,242,2026-01-14,,https://www.commondreams.org/news/ro-khanna-ice-minneapolis
Lag,"PLEASE HELP My friend is having issues with his connection, his internet works just fine but the server lags.",8,13,2026-01-14,We thought its because of the multiplayer function but even on a remote host it lags. We bought the server. It shows connection icon issues on top left,https://i.redd.it/yki41fp9o6dg1.png
Lag,Severe lag spikes during co-op play,30,28,2026-01-14,"My friend and I are playing together. We’re in the same country and hosting our own server, but we keep getting frequent ping spikes and sudden desync. After about 15 seconds everything goes back to normal, but during that time the game is basically unplayable.   What could be causing this?",https://www.reddit.com/r/hytale/comments/1qc73lx/severe_lag_spikes_during_coop_play/
Microtransaction,"Thia game is fucked up, good but totally fucked up. Nightmarish stuff",5542,372,2026-01-14,AI btfo.,https://i.redd.it/r9n65gz058dg1.jpeg
Lag,How To Fix Lag Issue? It's game breaking,2,13,2026-01-14,"(sorry for the shitty screen record quality) It didn't always do this, it was completely fine the past two days. It did this when I first downloaded, but that was on an SSD, I uninstalled and re-downloaded on my laptop itself, seemed to fix it. Now it's doing it again, I've got no clue what it even is or how to fix it. You'll notice it undid my reload as well, just after I did it and the surveyor pulls a houdini. So its not a frame rate issue I don't think, its like the whole game just lags 30 seconds behind for me and me alone. I can't shoot any ARC because they're not actually where I'm aiming, or I run somewhere I think is clear and then its all of a sudden not, or I've cleared it and then I all of a sudden haven't, and I get my shit rocked by ARC and my stuff lost to the ether. It wastes my time, my stamina, and my inventory. I really enjoy the game when it works so I really want to fix it. Please help.  Specs:  13th Gen Intel(R) Core(TM) i7-13700H 2.40 GHz  RAM: 16,0 GB (15,8 GB usable)  Graphics: NVIDIA GeForce RTX 4060  Windows 11 ver. 23H2",https://v.redd.it/ryoin3nnb7dg1
Price,Where the price is headed...,67,96,2026-01-14,"last April and May we got some silver at 32 and 33 an ounce.   It's been less than a year and now it's at around 89.   It doesn't feel like a shock to me. It feels like we had it coming for a long time. For those who knew, this was very predictable.  It is not at all out of the realm of possibilities that silver will hit 135-300 in 2026.   I think based on the current market conditions this is just the beginning of a historical price and ratio shift. Something we, or our parents have never seen in their lifetime. It is also plausible that this could be something that most people who have ever lived for the past 5,000+ years of silver and gold history have never (or rarely) seen this.  The market conditions are a perfect storm of increasing demand, supply and mining decreasing year over year.   We are at a point where the premiums are going to eventually have their own market within 1-5 years. The spot will be irrelevant. You think 14 dollars over spot is high? Wait till it's 2-3x spot. The computer says 300? Well that's cool, go get it at 300. What's the problem? It's out of stock everywhere? That'll be 1,000 for you.   We are headed into uncertain times as far as price is concerned. When I say uncertain I'm not talking about the downside, I'm talking about how crazy and how high it can and will most likely go.   We are headed to a time where the spot will be irrelevant, it will only be a matter of if you can get it physically in your hands.   The ratio between gold and silver will most likely hit 20 in these conditions. There's also a good probability that we will end up seeing a single digit ratio. If it gets bad enough it may be 1:1 gold to silver.  I know this sounds crazy, but this is what happens when you have a perfect storm that has never happened before in history.   This is not a typical year with a slight drop in the ratio closing to make a quick buck. This is not the hunt brothers trying to corner the market. This is not a small financial crisis. The dol",https://www.reddit.com/r/Silver/comments/1qby1xz/where_the_price_is_headed/
Unique,TIL the Sargasso Sea is the only sea on earth not bounded by land - instead is defined by four currents in the Atlantic Ocean. Contains unique sea weed.,5278,208,2026-01-14,,https://en.wikipedia.org/wiki/Sargasso_Sea
Druid,It's criminal dracthyr can't be druids - What creatures would you suggest for their other forms?,757,230,2026-01-14,,https://i.redd.it/u48ul6hk48dg1.png
Buff,New buffs/nerfs,1509,625,2026-01-14,,https://www.reddit.com/gallery/1qc51t1
Loot,Larian says BG3 proves hand-crafted loot is best for CRPGs,3034,363,2026-01-14,,https://frvr.com/blog/news/baldurs-gate-3-proved-hand-crafted-loot-is-better-for-crpgs-than-randomised-says-larian/
Shop,Getting 2 shopping carts taken within mins,4245,775,2026-01-14,"Just venting, but this drives me crazy. Within a couple mins of each other I had 2 shopping carts taken by someone. First was an older guy, my cart was empty I just entered, whatever I let him take it and go get another.   I have a new cart with my 1 item in it so far, left it and walk 3 feet away to get something, turn around and a couple had emptied my cart and take it. I see them walking away and ask them if that’s mine, they say sorry didn’t know it was someone’s and I ask them where my item is, they just dumped it onto a table.",https://www.reddit.com/r/Costco/comments/1qby0co/getting_2_shopping_carts_taken_within_mins/
