keyword,title,score,comments,date,text,url
Crash,Dramatically Under-Shared Video of Immediate Aftermath of Crash Scene of Renee Good’s Car Following Her Un-aliving,4826,878,2026-01-08,"This video was taken by a neighbor, in front of whose house Renee Good’s car crashed after she was unalived by an ICE agent.  It shows her grieving wife sitting in the snow, covered in her deceased partner’s blood.  I haven’t seen this one making the rounds, and it needs to be put on blast.  ",https://v.redd.it/6055oh1ce2cg1
Druid,The Haranir Druids speak for Harandar! And we have made it to the final race. What class do you associate with the Earthen of Khaz Algar? Note: this will be a full round and not a lightning one.,845,143,2026-01-08,,https://i.redd.it/cx4vqdlix1cg1.png
Druid,Druids (and spiders) hate this one easy trick,2500,83,2026-01-08,,https://i.redd.it/91bhq1j552cg1.jpeg
Patch,League of Legends 2026 Patch 26.1 Notes,1628,904,2026-01-08,,https://www.leagueoflegends.com/en-us/news/game-updates/patch-26-1-notes/
Paladin,If a fully loaded Knight Paladin ended up in Age of Sigmar. Could it dominate Armies or Areas ?,1267,154,2026-01-08,,https://i.redd.it/xrzju1rm5zbg1.jpeg
Shop,"Went shopping. Tried some stuff on, but didn't buy anything.",21325,197,2026-01-08,,https://i.redd.it/km9drlc480cg1.jpeg
Buff,The 4 horsemen of “we hate dive we want more buffs”.,3154,456,2026-01-08,,https://i.redd.it/mki73u2x74cg1.jpeg
Microtransaction,no battle royale no microtransactions just pure skill and good memories,2306,250,2026-01-08,,https://i.redd.it/vv57396vs3cg1.jpeg
Nerf,The Reddit-minority nerf supporters are in for a rude awakening in the coming months.,0,43,2026-01-08,"Blizzard is alienating the core fan base that wanted TBC in the first place. You can cope and huff kool-aid all you want that TBC fans will play anyway, but the truth is most of us are not going to play a watered down version of our favorite game. This is crystal clear to anyone who actually plays this game and doesn’t just spend all day trolling Reddit.  There will be a moderate post launch hype, followed by rapid decline. The audience blizzard is appealing to are the people who chase a fresh launch high, and then quit by the next phase.  The truth the Reddit minority doesn’t want to hear is that pre-nerf raids (outside a couple outliers which still aren’t that hard) are some of the most casual friendly and easy raids in WoW’s history. Post nerf takes something easy and just deletes all engagement and meaningful gear progression. There is no die hard TBC fan who wants that off the rip, because the quality of the original TBC raids is one of the biggest improvements it had over vanilla while sticking to the core design philosophy.  TBC anniversary (barring a last minute compromise or course correction), will eventually become the worst performing classic iteration.   The classic team was in far superior hands with Brian Birmingham. Aggrend listens to too many streamers. ",https://www.reddit.com/r/classicwow/comments/1q6qr0s/the_redditminority_nerf_supporters_are_in_for_a/
Battle Pass,Buying the Battle Pass turned this game into a second job and completely burned me out,1267,620,2026-01-08,"**Not gonna lie**, I usually buy the Battle Pass in every game I actually plan to spend time on. It’s always nice to have some side rewards while you’re just playing normally. To me, that’s literally the whole point of a Battle Pass: keep players invested and reward them for their time.  But **BF6’s Battle Pass** is easily one of the most **grindy, time-consuming, and miserable** Battle Passes I’ve ever experienced in any game.  The people who designed this system clearly mastered the art of squeezing as much playtime out of players as possible, turning the game into a **second job**: - You need enough XP to unlock **1 star**, and you need **10 stars just to gain 1 tier**. - The XP required per star keeps increasing, to the point where it takes **2–3 matches for a single star**. - All of this exists to **force you to log in weekly** and grind through a list of challenges / *chores*, which is where most of your time actually goes. - These chores are **terribly designed**. You like playing Medic? Too bad — here are **4 Engineer challenges**, go destroy **10 vehicles with mines**. You enjoy Conquest like a normal Battlefield player? Sorry, best we can do is **Redsec, Gauntlet, Team Deathmatch**, etc. Because otherwise, nobody would touch those modes. - After people complained that Week 1 chores forced Redsec, they “fixed” it by giving us **4 rerolls per week** — only to then give you **exactly 4 Redsec/Gauntlet missions every week**, forcing you to burn all rerolls just to escape them, with none left for anything else.  I work **8–10 hours a day**, only to come home and spend **another 2 hours** doing Battle Pass chores just to keep up — because I was dumb enough to trust BF6 and now I don’t want to waste the money I already paid.  In most other games, you can **finish the Battle Pass just by playing normally and earning XP**. Challenges are optional and only help you progress faster.  In this game, you’re forced to **invest 100% of your time into it**, or you fall beh",https://i.redd.it/mu2slixygybg1.png
Paladin,RIP to this guy who just 4 hours ago finished massive Blood Elf Paladin exp preparation,896,453,2026-01-08,,https://i.redd.it/mwtgfw34dzbg1.jpeg
Rubberbanding,"Known issue or some sort of hack? Forward rubberbanding, super sus profile, who has 2 KD and 60 awol with this many hours?",158,54,2026-01-08,"Must be a cheater no? im a steam timmy and got 3.44 kd. I also mixed MIA with AWOL, so dont mind that in the title..",https://v.redd.it/zzhsq4f024cg1
Last Epoch,Thinking about coming back to Last Epoch – is it better now?,0,39,2026-01-08,"Hey all,  I’ve been thinking about coming back to **Last Epoch**. I’ve basically finished what I wanted to do in **Diablo 3 Season 37** and **Diablo 4 Season 11** — full build, clearing the highest Torment, and once I hit that point I’m usually done with the season.  Problem is, I still need that ARPG fix while I’m playing other RPGs on the side.  I haven’t really played Last Epoch since around full launch. I remember quitting mainly because I *really* disliked the market system at the time, and I wasn’t a big fan of the idol system either. How are those systems now? Any major improvements or changes?  As for builds:   I previously played an **Acolyte Warlock** build where you open a rift in the ground that shoots a bunch of different projectiles — that build was *super* fun.  Right now I’m considering:  * **Rogue** (not sure which mastery) * **Primalist Shaman** * **Acolyte again**, since the dark mage vibe is always my favorite (Necromancer in Diablo, Warlock in WoW, Witch in PoE, etc.)  Any fun or standout builds you’d recommend?  Or… should I just play **Lost Ark** again instead?   (Please don’t say that 😅)  Edit: Thank you all for the answers, I will wait for the new season to play there, and try PoE2 while I wait.",https://www.reddit.com/r/LastEpoch/comments/1q78g6q/thinking_about_coming_back_to_last_epoch_is_it/
Drop rate,"Detroit Murders drop to lowest in 60 years, rate almost 50% lower than 30 years ago.",1519,142,2026-01-08,,https://www.detroitnews.com/story/news/local/detroit-city/2026/01/07/detroit-murders-fall-below-200-first-time-six-decades-police-chief-says/88051258007/
Queue,"Roses are red, you can join a queue",7978,280,2026-01-08,,https://i.redd.it/iyookzid23cg1.jpeg
Disconnect,"Hard to believe this was our club 7 months ago. From finally winning a trophy…. to this? Players and fans feeling disconnected, while ownership is chasing record profits at the expense of lifelong supporters. No clue where we go from here — I just hope it’s anywhere but where we are now.",968,306,2026-01-08,,https://i.redd.it/p8rs1a8pp0cg1.jpeg
Rubberbanding,PR´s AI Rubberbanding is next level holy shit,54,11,2026-01-08,One of the most frustating things about this game is the AI heavily relying on the rubberband so much that not even skill and track knowledge can save you. Not to even mention the Hard and Hardcore difficulties where half of the pack is pulled away from your POV and traveling at insane speeds around the track while you are in 6th and 5th place till they slow down at the last lap.,https://i.redd.it/0n4rtys1hzbg1.png
Rubberbanding,Aminin mo nahirapan ka din noon sa pagawa ng bahay ni Tarzan gamit ang rubberband. Labas ka nga lahat ng nakagawa neto🤣,99,21,2026-01-08,,https://i.redd.it/stpu1y9oj4cg1.jpeg
Unique,Unique threats,3854,482,2026-01-07,"Isabella (Phineas and Ferb)  Phone speech (Taken)  “I don’t know who you are. I don’t know what you want. If you are looking for ransom I can tell you I don’t have money, but what I do have are a very particular set of skills. Skills I have acquired over a very long career. Skills that make me a nightmare for people like you. If you let my daughter go now that’ll be the end of it. I will not look for you, I will not pursue you, but if you don’t, I will look for you, I will find you and I will kill you.”",https://www.reddit.com/gallery/1q5uj7c
Microtransaction,3 more days until microtransaction and gambling come to creative islands 🫩,704,105,2026-01-07,,https://v.redd.it/zi4yufp5dubg1
Disconnect,"[Lewis Hamilton] Another return. I’m incredibly grateful for this break. Time to disconnect, recharge and find a bit of inner peace. (Full caption in the comments)",2532,150,2026-01-07,,https://www.reddit.com/gallery/1q6g6fw
Rogue,Rogue has been in the game for a bit now. How do you all feel about her now?,1429,571,2026-01-07,"I’ve seen a lot of people change their minds about her, and I have a little too. She’s really fun, but even when I’m playing her well, she just doesn’t feel as valuable as other tanks. ",https://i.redd.it/sxpwqiqy3tbg1.jpeg
Sorcerer,"In strange things season 5 (2025-2026) after will awaken his powers, Mike automatically calls him sorcerer, despite the fact the sorcerer only appears in dnd 2000 edition",6691,164,2026-01-07,,https://i.redd.it/jy8wcmqiusbg1.png
PTR,"Honor Costs of Level 60 PvP Gear has been increased on the PTR, Weapons Remain the Same",100,126,2026-01-07,Just to add more uncertainty to what values will be at pre-patch launch!,https://www.reddit.com/gallery/1q67hjz
Queue,Rank 1 player in flex queue on Brazil server has over 5000 LP with 403 wins 12 losses,1066,147,2026-01-07,https://op.gg/de/lol/summoners/br/repri-%E9%B4%89%E5%B7%A3%E7%94%9F%E9%B3%B3 is the account. Doesn't even seem that he is manipulating the matchmaking by queueing with friends on low elo accounts - they are mostly top challenger players just tryharding in 5 stack flex  The #2 player 'only' has 3000LP https://op.gg/de/lol/leaderboards/tier?type=ladder-flex  How is that LP number possible though? Shouldn't he be getting like +1 LP per win at some point since he is several thousand LP above everyone else?,https://www.reddit.com/r/leagueoflegends/comments/1q6cit3/rank_1_player_in_flex_queue_on_brazil_server_has/
PTR,"[NFA] 20% off and free shipping on all in stock YHM Suppressors, all in stock Resilient Suppressors, OCL Lithium 9 Black and FDE, OCL Titanium K, OCL Polonium K, PTR Vent 2, LPM Anthem S2-QD-Code SAVE 20| 30% off and free shipping on all Rugged Suppressors in stock Code SAVE30 | No Tax unless in VA",52,101,2026-01-07,"Hey CSG Fam!!!!  Hope everyone had an awesome holiday season and New Year. We’re back with some great suppressor deals and ready to help you out. If you see something on the site that’s not on this list, hit us up, we can usually work a deal and beat pricing.   Train Hard,  CSG Founders  [Resilient ](https://csgarmory.com/?s=resilient&amp;post_type=product&amp;ixwps=1&amp;wps-title=1&amp;wps-excerpt=1&amp;wps-content=1&amp;wps-categories=1&amp;wps-attributes=1&amp;wps-tags=1&amp;wps-sku=1&amp;ixwpsf[taxonomy][product_tag][show]=set&amp;ixwpsf[taxonomy][product_tag][multiple]=0&amp;ixwpsf[taxonomy][product_tag][filter]=1&amp;ixwpsf[taxonomy][product_tag][op]=or&amp;ixwpsf[taxonomy][product_cat][show]=all&amp;ixwpsf[taxonomy][product_cat][multiple]=0&amp;ixwpsf[taxonomy][product_cat][filter]=1&amp;ixwpsf[taxonomy][pa_brand][show]=all&amp;ixwpsf[taxonomy][pa_brand][multiple]=1&amp;ixwpsf[taxonomy][pa_brand][filter]=1&amp;ixwpsf[taxonomy][pa_brand][op]=or&amp;ixwpsf[taxonomy][pa_caliber][show]=all&amp;ixwpsf[taxonomy][pa_caliber][multiple]=1&amp;ixwpsf[taxonomy][pa_caliber][filter]=1&amp;ixwpsf[taxonomy][pa_caliber][op]=or&amp;ixwpsf[taxonomy][pa_capacity][show]=all&amp;ixwpsf[taxonomy][pa_capacity][multiple]=1&amp;ixwpsf[taxonomy][pa_capacity][filter]=1&amp;ixwpsf[taxonomy][pa_capacity][op]=or&amp;ixwpsf[taxonomy][pa_color][show]=all&amp;ixwpsf[taxonomy][pa_color][multiple]=1&amp;ixwpsf[taxonomy][pa_color][filter]=1&amp;ixwpsf[taxonomy][pa_color][op]=or&amp;ixwpsf[taxonomy][pa_grain_weight][show]=all&amp;ixwpsf[taxonomy][pa_grain_weight][multiple]=1&amp;ixwpsf[taxonomy][pa_grain_weight][filter]=1&amp;ixwpsf[taxonomy][pa_grain_weight][op]=or&amp;ixwpsf[taxonomy][pa_model][show]=all&amp;ixwpsf[taxonomy][pa_model][multiple]=1&amp;ixwpsf[taxonomy][pa_model][filter]=1&amp;ixwpsf[taxonomy][pa_model][op]=or&amp;ixwpse=1&amp;in_stock=1)  [OCL Lithium 9 Black and FDE](https://csgarmory.com/?s=lithium&amp;post_type=product&amp;ixwps=1&amp;wps-title=1&amp;wps-excerpt=1&amp;wps-co",https://csgarmory.com/?s=yhm&amp;post_type=product&amp;ixwps=1&amp;wps-title=1&amp;wps-excerpt=1&amp;wps-content=1&amp;wps-categories=1&amp;wps-attributes=1&amp;wps-tags=1&amp;wps-sku=1&amp;ixwpsf[taxonomy][product_tag][show]=set&amp;ixwpsf[taxonomy][product_tag][multiple]=0&amp;ixwpsf[taxonomy][product_tag][filter]=1&amp;ixwpsf[taxonomy][product_tag][op]=or&amp;ixwpsf[taxonomy][product_cat][show]=all&amp;ixwpsf[taxonomy][product_cat][multiple]=0&amp;ixwpsf[taxonomy][product_cat][filter]=1&amp;ixwpsf[taxonomy][pa_brand][show]=all&amp;ixwpsf[taxonomy][pa_brand][multiple]=1&amp;ixwpsf[taxonomy][pa_brand][filter]=1&amp;ixwpsf[taxonomy][pa_brand][op]=or&amp;ixwpsf[taxonomy][pa_caliber][show]=all&amp;ixwpsf[taxonomy][pa_caliber][multiple]=1&amp;ixwpsf[taxonomy][pa_caliber][filter]=1&amp;ixwpsf[taxonomy][pa_caliber][op]=or&amp;ixwpsf[taxonomy][pa_capacity][show]=all&amp;ixwpsf[taxonomy][pa_capacity][multiple]=1&amp;ixwpsf[taxonomy][pa_capacity][filter]=1&amp;ixwpsf[taxonomy][pa_capacity][op]=or&amp;ixwpsf[taxonomy][pa_color][show]=all&amp;ixwpsf[taxonomy][pa_color][multiple]=1&amp;ixwpsf[taxonomy][pa_color][filter]=1&amp;ixwpsf[taxonomy][pa_color][op]=or&amp;ixwpsf[taxonomy][pa_grain_weight][show]=all&amp;ixwpsf[taxonomy][pa_grain_weight][multiple]=1&amp;ixwpsf[taxonomy][pa_grain_weight][filter]=1&amp;ixwpsf[taxonomy][pa_grain_weight][op]=or&amp;ixwpsf[taxonomy][pa_model][show]=all&amp;ixwpsf[taxonomy][pa_model][multiple]=1&amp;ixwpsf[taxonomy][pa_model][filter]=1&amp;ixwpsf[taxonomy][pa_model][op]=or&amp;ixwpse=1&amp;in_stock=1
Sorcerer,Unc realized he not built for this era of sorcerers,2188,227,2026-01-07,,https://i.redd.it/oq9g0l4ohvbg1.jpeg
Season 11,Do you think Scheana regrets siding with Lala and Sandoval over Ariana during season 11,673,269,2026-01-07,Came across this tik tok of throwback pics of Ariana and Scheana and forgot how long they were actually friends for. ,https://www.reddit.com/gallery/1q5wmmn
Sorcerer,I just realised. Non sorcerers cant see Cursed Techniques. Which means people in Sendai had a pretty good day.,4631,109,2026-01-07,,https://i.redd.it/6atsw4irorbg1.jpeg
Price,$6 a cookie? Fear of over pricing,14017,3039,2026-01-07,"Please scroll through photos! These are my 4 inch wide, 1 inch thick chewy brown butter cookies. I ran my costs and how much each cookie costs, and to be making a profit that's worth my while, 6 dollars seems to be the perfect number considering my labor, gas, ingredients etc.   However I'm scared people will think I'm overpriced, I recently got my cottage food license and professional packaging in bulk. My plan is to go to shopping centers / malls three hours a day every week 5 days a week trying to sell 50 cookies a day.   So far a local restaurant has been able to sell about 20 consistently a week (it's a pizza place with older clientele) so I'm a bit hopeful, but I'm worried still that I won't get bites. I live in San Diego California, a star bucks cake pop is 4 bucks, a single crumble cookie is 5 bucks, nothing Bundt cakes mini is 8 bucks. Do you guys think 6 dollars a cookie is bad for me? ",https://www.reddit.com/gallery/1q68gtw
Necromancer,Any necromancer who can give me tips how to raise more capable undead?,5110,82,2026-01-07,,https://v.redd.it/mkrxyy2frrbg1
Price,Is this why the price of ram and graphics cards are sky high?,7511,587,2026-01-07,,https://i.redd.it/wltlup1t0tbg1.jpeg
Spiritborn,Need help with Spiritborn Evade Build. Why am i doing no dmg?,5,8,2026-01-07,I am using every Bis item recommended by maxroll.   Im lacking doing any Damage. Even elites wont die anymore. What did i mess up? Is it some sanctification thats blocking damageoutput idk…please help,https://www.reddit.com/gallery/1q5sr3s
Patch,PSA for how to predict upcoming patches,273,42,2026-01-07,"The best indicator we have (aside from Yoshi actually telling us something) is [this spreadsheet which tracks changes to the Version Number of the experimental server](https://docs.google.com/spreadsheets/u/0/d/1ZANjVfHNdZ7q6jCuKbt_ACmlL2E4ht1Fmks1RrMS3xE/htmlview#gid=0). The biggest indicator that a patch is imminent is if you have a span of 2 days where the Version Number increased dramatically (e.g. by more than 20) each day.  Currently, the experimental server version number hasn’t changed since the 3rd. Consequently, I do not expect a patch today (Tuesday) or within 2 days (Wednesday/Thursday). The version number usually changes a decent amount on Wednesdays and Saturdays (which I assume are days of regularly scheduled internal tests), so if the version number changes a ton on Wednesday and then Thursday, maybe the update drops Friday.  Personally I’m betting that we’ll see a big spike on Saturday and Sunday followed by a release on Monday (for a Monday/Wednesday/Friday schedule of hero releases like last time) but that would just be a perfect repeat of what happened last time and Valve probably isn’t *that* predictable. (Edit: Comments have convinced me that the holiday event probably ends on the 15th and the patch totally won't drop before then, therefore my most realistic guess is Monday, the 19th.)  Anyway, now you know a little more about how to read the tea leaves.",https://www.reddit.com/r/DeadlockTheGame/comments/1q60gb8/psa_for_how_to_predict_upcoming_patches/
Crash,House Republican Jim Baird hospitalized after car crash,6461,812,2026-01-07,,https://thehill.com/homenews/house/5674649-house-republican-jim-baird-hospitalized/
Paladin,"Shut up, masochistic paladin",2899,40,2026-01-07,link art: [https://pin.it/5VWpw9n9Q](https://pin.it/5VWpw9n9Q),https://i.redd.it/rzq3nn5f9tbg1.jpeg
Crash,maga dude crashes out after trump gets called a fascist,6132,536,2026-01-07,,https://v.redd.it/iexaj2svdtbg1
Unique,Yua Fukuda Navigates a Unique Relationship,10,0,2026-01-07,Yua Fukuda finds herself in an unusual yet increasingly common relationship dynamic as she navigates life with a partner who has a strong passion for cosplay. [https://kwavebuzz.com/yua-fukuda-navigates-a-unique-relationship-with-a-cosplay-loving-partner/](https://kwavebuzz.com/yua-fukuda-navigates-a-unique-relationship-with-a-cosplay-loving-partner/),https://v.redd.it/2ab9cub5hwbg1
Sorcerer,Yuji is the strongest sorcerer ever,1189,438,2026-01-06,,https://i.redd.it/3hjqopggxlbg1.jpeg
Price,Found on TikTok. Loblaws criminal pricing continues.,3328,1051,2026-01-06,,https://v.redd.it/47z432annqbg1
Nerf,Nerf Hunting Deer,3561,316,2026-01-06,,https://v.redd.it/ckjvt4gqdlbg1
Competitor,"TIL: Samir and the codriver from ""You're breaking the car Samir!"" took legal action and found the video was made by a competitor to make them look bad.",7834,151,2026-01-06,,https://www.thedrive.com/news/samir-youre-breaking-the-car-was-a-career-ruining-hit-job
Loot,Red Lockers = Best Loot,4444,379,2026-01-06,,https://i.redd.it/uzkpgwmlrjbg1.jpeg
Paladin,Playing a Paladin with only +4 to hit is pretty tough,1298,139,2026-01-06,,https://i.redd.it/fbxhxg3nxlbg1.jpeg
Uber Unique,"Without any uniques,only runewords and magical items what would be best class/build to kill the ubers?",12,27,2026-01-06,,https://www.reddit.com/r/d2r/comments/1q51hap/without_any_uniquesonly_runewords_and_magical/
Uber Unique,"Without any uniques,only runewords and magical items what would be best class/build to kill the ubers?",3,2,2026-01-06,,/r/d2r/comments/1q51hap/without_any_uniquesonly_runewords_and_magical/
Loot,Stop hoarding trash! I built a free Dynamic Loot Tracker to help with Inventory Management,8,10,2026-01-06,"Hey Raiders,  Managing inventory space in this game has always been a massive headache for me. I constantly found myself asking: *""Do I recycle this, or will I regret it because I need it for a quest later?""*  Static spreadsheets didn't really cut it for me because what counts as ""trash"" changes completely depending on your progress. I wanted something interactive that adapts to *my* current Quests and Projects.  So, I built a tool to fix this for myself and figured it could be useful for the community. No account or user data needed.  **🔗 The Tool:** [**arcraidershub.net**](https://arcraidershub.net)  https://preview.redd.it/yhto66nqvpbg1.png?width=1902&amp;format=png&amp;auto=webp&amp;s=ba24e1f37891026152fff59f0e250ca11a2abb77  # 🆕 What makes it different? (Dynamic Tracking)  Unlike static lists, this tool adapts to your personal progress.  * **Check off Quests &amp; Projects:** You can select exactly which quests you are currently working on and mark finished ones as done. * **No Login Needed (Saved Locally):** Your progress is saved automatically in your browser's local storage. You don't need to create an account or provide any data. * **Dynamic Recommendations:** This is the most important part. As you check off quests &amp; projects, the tool **dynamically changes** the item status.    * *Example:* You need a **Flow Controller**. The tool marks it as **🟢 KEEP**.    * *Action:* You mark the quest ""Snap and Salvage"" as **☑️ DONE**.    * *Result:* The tool instantly updates the Flow Controller to **♻️ RECYCLE**, so you know you can safely get rid of it.  https://preview.redd.it/p6cnge1svpbg1.png?width=658&amp;format=png&amp;auto=webp&amp;s=40c2fdce3117c7aa91b819b49116559b05eb835f  # 🌍 Languages &amp; Feedback  The tool is fully mobile-friendly (great as a second screen while playing). Currently available in: **🇺🇸 English, 🇩🇪 German, 🇪🇸 Spanish** and **🇷🇺 Russian**!  Also mobile firendly:  https://preview.redd.it/vi5eojtwvpbg1.png?width=409&amp;format=png&amp;aut",https://www.reddit.com/r/ArcRaiders/comments/1q5gtvj/stop_hoarding_trash_i_built_a_free_dynamic_loot/
Crash,[Highlights] Booker straight up causes SGA to crash to the ground,4441,1081,2026-01-06,,https://streamable.com/5u06a1
Necromancer,Necromancer Party. Is it fun or tedious?,496,126,2026-01-06,"Hi all, title.  Had a silly idea to do a full evil necro party. It sounds fun in theory but I'm a bit worried it'll just be annoying and wanted opinions from those who've done something similar.  The party idea is: - Necromancer Wizard - (Player character). - Death Cleric. - DJ Shart. - Oathbreaker Paladin. - Minthara.  And undecided on the 4th but either: - Hexblade Warlock (extra necrotic damage at 12, hex, free summom, and the spectres are undead). - Circle of Spores Druid (idk much about this one).",https://i.redd.it/8xwjgqtnrkbg1.png
Queue,"Coming from Dota, solo queue in LoL feels unusually quiet",1323,602,2026-01-05,"I played Dota2 for years(4.7k h) and recently started playing more League solo queue.  One thing I still find strange is how quiet games feel. In Dota, voice is just there, so even with randoms people usually talk. calls, roams, objectives, arguments, everything. In LoL, since there’s no built-in voice, it feels like all communication is pings and short text messages, and most games nobody really says much.  I’m curious how other solo players experience this:  When you load into a ranked game with randoms, how do you usually communicate?   Do you rely only on pings/text, or do people ever try to talk outside the game?   Have you ever tried using Discord or anything similar with random teammates, or do you just not bother?  Not saying one is better  just feels very different, and I’m wondering if this is the normal solo-queue experience.",https://www.reddit.com/r/leagueoflegends/comments/1q4l6up/coming_from_dota_solo_queue_in_lol_feels/
Buff,"sometimes it's not just a powercreep, but it is a needed buff.",5558,221,2026-01-05,,https://i.redd.it/o7645lgwmebg1.jpeg
Rogue,It isn’t Rogue that takes everything. It’s Luna.,2389,241,2026-01-05,,https://i.redd.it/3xihk8ppvebg1.jpeg
PoE,Edgar Allen Poe and his cousin Wife Virginia Clem Poe. He was 27 and she was 13 when they wed but lied on paperwork saying she was 21 as he father was dead and he could give consent due to her age.,1705,523,2026-01-05,,https://i.redd.it/0msa5eekkjbg1.jpeg
