keyword,title,score,comments,date,text,url
Paladin,Replaying the story as a Paladin just hits different,1812,130,2025-12-28,"Not only is the armor much cooler in cutscenes, but the defiance against the Church of Inarius feels so much stronger.   Doned in the robes of the church and fighting with the power of angels to defeat the forces of hell. The Paladin lives the truth that the church masquerades",https://i.redd.it/kf96acozgt9g1.jpeg
Barbarian,"Bull was voted as the Barbarian, who's our Bard?",439,139,2025-12-28,"A Bard is someone that can inspire and empower their allies or manipulate, seduce and weaken foes through word and song. The most upvoted comment will decide.",https://i.redd.it/mvm3ityrir9g1.png
Competitor,"Finally, a worthy competitor 💀",2675,70,2025-12-28,,https://i.redd.it/jgpklgeoyv9g1.jpeg
Shop,At the “Pawn Stars” shop OC,30796,594,2025-12-28,,https://i.redd.it/tzizq5np9s9g1.jpeg
Microtransaction,"If your favorite MMORPG was released today in your favorite build, available through a single purchase and no microtransactions, but entirely singleplayer, would you buy it?",43,181,2025-12-28,"One thing I noticed is the sheer amount of people playing MMOs solo, asking which MMO has the best solo content, if it's solo friendly, etc.   So, if your favorite MMORPG was released as described in the post title, would you play it?  Personally, no. For me, the main point of an MMO is to engage in social activities. Group dungeons, open world PvP, the thrill of never being entirely safe, all of that are the things that make MMOs truly memorable to me.   I think I noticed how much I value other people in social games when Safer Seas was announced in Sea of Thieves. Sure, I'm a solo player and I'm always in a disadvantage in PvP, but the game just doesn't feel fun to play if I'm not under any sort of pressure.   What are your opinions and experiences?",https://www.reddit.com/r/MMORPG/comments/1px0kf0/if_your_favorite_mmorpg_was_released_today_in/
Price,Dynamic Pricing,7884,407,2025-12-27,"Who's gonna create a Raspberry Pi hack to lower the prices to a penny?    Big box stores already do this with their own inventory to make it so the consumer gets screwed when they return an item without a receipt. It shouldn't be hard to force the system's hand into creating a ""sale"" on items.   And if Raspberry Pi isn't the correct tool then I'm sure there's another or Flipper Zero or something that will work. Any ideas?   Imagine borrowed from another Reddit post.",https://i.redd.it/0bp6zuvlcl9g1.jpeg
Battle Pass,Is there a way to disable battle pass spam at startup?,953,300,2025-12-27,"Is there a way to disable these battle pass screens that show up every time I start the game? I checked the options, but couldn't find anything. ",https://i.redd.it/u7x5oy3ufr9g1.png
Paladin,"Turn Karlach into a monk before fighting the ""paladins""",6425,200,2025-12-27,"Normally she roars in rage when she &gt;!tears up the tollhouse!&lt;. But what if we were in an alternate reality, where Karlach took a different path, and instead of harnessing her rage, she learned to control it? What does it sound like when Karlach is ruled not by incandescent fury but by inner calm?  I'll tell you. &gt;!Instead of roaring in rage while destroying the tollhouse, she runs around yelling HIIIIIIIIIIIIIIYA like Miss Piggy while destroying the tollhouse, and it is glorious 🤣🤣🤣!&lt;  (she had no weapons on her when I did this, not sure if that triggers it or if it's just the monk class. Also now I'm curious what it sounds like if she's a wizard????)",https://www.reddit.com/r/BaldursGate3/comments/1pwpmcs/turn_karlach_into_a_monk_before_fighting_the/
Loot,Dorms marked post loot nerf.,1625,352,2025-12-27,"First dorms marked room I open post nerf, this is all I got.",https://i.redd.it/j33y2sitcq9g1.png
Unique,"Brown dipper, a passerine bird uniquely adapted to live and feed underwater in fast-flowing, cold mountain rivers",20248,205,2025-12-27,,https://v.redd.it/koqtj4rner9g1
Unique,Characters who have unique rules that must be followed in order to appear in other media,5359,986,2025-12-27,"2B (Nier Automata) She must be shown in her full glory in order to crossover in media, she cannot be censored.   The Rock (IRL) He has a rule in his contract that in whatever media he is in, he can’t lose a fight",https://www.reddit.com/gallery/1pwh19m
Nerf,All of the NERFS and BUFFS coming in the January 2026 Balance Changes,410,130,2025-12-27,The First Update for Clash Of Clans in 2026 will have MASSIVE Balance Changes!  A Bunch of Nerfs and Buffs to some of the Most Popular and NOT so popular things in the game right now The Most Notable Ones are the Guardians and Totem Spell.  What do you guys think about these Balance Changes? What would you guys like to see changed in the future?  EDIT: I also forgot my graphic where Electro Dragon and Life gem are also getting slightly buffed on most levels!,https://www.reddit.com/gallery/1pwxwxv
Spiritborn,Pulverize Druid or evade spiritborn,8,17,2025-12-27,"So, like everyone else, I have my Paladin that is pushing pit 100s, but to avoid boredom I wanna try a class that isn’t as overpowered.  Of the two builds listed, what is generally better at high levels/easier to play?",https://www.reddit.com/r/diablo4/comments/1pwbfop/pulverize_druid_or_evade_spiritborn/
Buff,"I asked all the different reddit strategist main communities for the buffs/ nerfs they would give their character, here are the findings.",1843,331,2025-12-27,"I will be the first to admit this was a bit flawed, in the descriptions I would give my own opinion which might have influenced the response, idk. Was supposed to be a daily thing but Holidays was an issue. Keep in mind that the first 4 responses were before 5.5.  Invisible Woman:  &gt;First of all she should have 0 cool down on all her abilities, second she should be able to shield all of her team at the same time, increase her damage to 1000, and her team up ability should give 500 over shield. Any other take is just wrong.  u/Hecarti2006, 41 upvotes  Ultron:  &gt;Give him a second drone  &gt;increase flight speed slightly but also hit box size to compensate  &gt;make his firewall cleanse debuffs but increase its cooldown  &gt;give him an alternate attack that lobs an aoe projectile that heals and damages (like his ult projectiles but just a single shot)  &gt;Make his ult leave residual healing puddles when fired at the ground  &gt;Reduce primary fire damage but increase fire rate  &gt;Make his flight mode have a cooldown, the devs dimoly cannot balance a perma flying strategist  &gt;Genuinely wouldn’t be broken with how OP Sue and Gambit are rn  u/MajorMeatshield, 5 upvotes  Adam:  &gt;I don't need mobility, all I'm asking is faster reload time and more reliable and consistent healing  u/HimmelSky, 20 upvotes  Gambit:  &gt;His ultimate is the only issue I see with his kit. Nerfs to his ultimate charge or nerf to charging teammates ultimates or both.  u/Urjustnotgood, 28 upvotes  Jeff:  &gt;I’d love for his ult to get a full rework because it’s his biggest weakness. It’s so inconsistent and hard to get value from.  &gt;The puddle they gave it legit just made it *useable* since before it was genuinely a throw to use your ult in almost any situation due to the fact that your team loses a healer for the duration.  u/Darkwing_Dork, 14 upvotes  Rocket:  Bit confused because its a tie as of writing this, before the top comment was that he was fairly balanced, IDK now. I",https://i.redd.it/nz3t65ujdo9g1.png
Shop,Went shopping at Walmart today and my husband sends me this..,9114,546,2025-12-27,"It's a lot of money, especially after Christmas but he said he would sell his old one to recover the expense. He's really happy about finding it and couldn't wait to get home. ",https://i.redd.it/wlkimb5f7m9g1.jpeg
Shop,More red flags than a communist dive shop,26005,416,2025-12-27,,https://i.redd.it/j6ojj1gb4m9g1.jpeg
Paladin,Shoutout to Blizzard for Paladin build variety.,1922,243,2025-12-27,"I just want to take a minute to give Blizzard a shoutout for the amount of variety they’ve designed into the Paladin. I started the season as a holy hammer thrower, shield-bashed my way to 60, and now I’m in T2 playing a Zeal build after finding a Red Sermon.  Each build I’ve played has felt uniquely powerful. My favorite part is how much you can lean into the role-playing aspect of each build. Right now I genuinely feel like a righteous Zealot, and it’s awesome.  One last thing I want to call out: even though the top meta builds rely on Arbiter, you don’t feel weak playing something else—you just aren’t god-like. I’m running Red Sermon Zeal with Consecration instead of Arbiter, and it feels totally viable.  Well done, Blizzard. Please take the Paladin approach with any future classes you add to the game.",https://i.redd.it/mhas3c534l9g1.jpeg
Paladin,Draenei Paladins (and their giant crystal hammers) are the Exodar's favorite! Time to drive on down to Undermine. Which class do you associate most with Goblins?,806,221,2025-12-27,,https://i.redd.it/3ntgwfgg2o9g1.png
Paladin,I FUCKING LOVE PLAYING PALADIN,727,184,2025-12-27,I FUCKING LOVE PLAYING PALADIN IN DIABLO IV I ENJOY WATCHING COUNTLESS HORDES OF SCUM BEING BISSECTED BY MY RIGHTEOUS FURY I ENJOY WATCHING THOSE FALLEN GATHER AROUND ME LIKE ANTS ONLY TO BE SLAUGHTERED IN THE NAME OF THE LIGHT AS THEY PATHETICALLY GO ''BLEEEUGH'' AND PERISH. IT FILLS ME WITH JOY. I LOVE WATCHING THE SCATTERED REMAINS OF SKELETONS STREWN AROUND THE BATTLEFIELD LIKE SOME TOYS THAT A KID HAPHAZARDLY LEFT AROUND. I FUCKING LOVE PALADIN. I LOVE ASCENDING TO THE HEAVENS AND CRASHING DOWN LIKE A METEOR OF RETRIBUTION AGAINST THE DARKNESS I ENJOY KILLING DEMONS SO MUCH ,https://www.reddit.com/r/diablo4/comments/1pwyawj/i_fucking_love_playing_paladin/
Disconnect,What Champion has the Biggest Disconnect Between Lore and Gameplay?,829,428,2025-12-27,"I know more or less that gameplay doesn't correspond to the lore of the Champion completely, but which Champions are the most different or which Champion's gameplay in your opinion doesn't reflect their general lore or theme?",https://www.reddit.com/r/leagueoflegends/comments/1pwkkce/what_champion_has_the_biggest_disconnect_between/
Battle Pass,"Do you Actually Need to Buy the Battle Pass, or can just clear the game being F2p?",0,20,2025-12-26,"For more clarification, what I meant when I say ""need to buy"" is if it's actually a large enough difference between f2p and whales, and is the battle pass good? ",https://www.reddit.com/r/Endfield/comments/1pvxmun/do_you_actually_need_to_buy_the_battle_pass_or/
Battle Pass,I won't buy battle pass again.,292,218,2025-12-26,"I wont buy battlepass again. As someone who primarily enjoys the core Battlefield multiplayer experience, I’m not a big fan of Battle Royale modes. Being forced to play RedSec in order to earn Battle Pass points makes progression feel restrictive rather than rewarding.  I’d appreciate having more flexible ways to earn Battle Pass points through traditional Battlefield modes, so players can progress while playing the modes they enjoy most.  https://preview.redd.it/bu09potrje9g1.png?width=1231&amp;format=png&amp;auto=webp&amp;s=5b79df031cc7b3e9fbb2035d3a86f46fe43cc84b  ",https://www.reddit.com/r/Battlefield6/comments/1pvkvy8/i_wont_buy_battle_pass_again/
Drop rate,"SWS: Marcos net trust rating drops to -3%, Sara Duterte rises to 31%",668,556,2025-12-26,,https://i.redd.it/ohood30cfh9g1.jpeg
Season 11,Jokic's seasonal averages through 30 games: 30/12/11 on 61/44/85 splits (71.8% TS),1982,190,2025-12-26,[https://www.statmuse.com/nba/player/nikola-jokić-9226/career-stats](https://www.statmuse.com/nba/player/nikola-jokić-9226/career-stats)  For reference last year he had 30/13/10 on 58/42/80 splits (66.3% TS)  So same volume but his efficiency is another level now ,https://www.reddit.com/r/nba/comments/1pvxxnq/jokics_seasonal_averages_through_30_games_301211/
Spiritborn,Recently bought Diablo IV: Vessel of Hatred (I think) for $20 but Spiritborne is locked,0,7,2025-12-26,When I put the game in it says it on the screen. Yet the Spiritborne class and I think some areas of the map are still locked for me. It does say Standard Edition on my receipt.,https://www.reddit.com/r/diablo4/comments/1pvky5u/recently_bought_diablo_iv_vessel_of_hatred_i/
Drop rate,College Football Playoff ratings drop 7% as NFL competition impacts viewership,2566,631,2025-12-26,,https://apnews.com/article/cfp-ratings-tv-alabama-oklahoma-espn-793e0c26cad0c9b4f7918821b4be08fb
Spiritborn,Which Rod is better for my Quill Volley Spiritborn build.,0,6,2025-12-26,Following this build. Thank you.   https://maxroll.gg/d4/build-guides/quill-volley-spiritborn-guide#season-theme-sanctification-header,https://i.redd.it/khy1hpzshd9g1.jpeg
Disconnect,"Are these springs bad? A garage tech told me that if the hand drawn line on the coils is not straight anymore, then it’s bad and needs replacing. Was he BSing me? It still swings up and down smoothly when disconnected.",604,262,2025-12-26,,https://www.reddit.com/gallery/1pvk511
Season 11,The Broncos are 11-2 in one possession games this season. The Chiefs are 1-8,2273,478,2025-12-26,The Broncos completely stole the Chiefs’ sorcery this season,https://www.reddit.com/r/nfl/comments/1pvv1kt/the_broncos_are_112_in_one_possession_games_this/
Microtransaction,What even is this season? Most anti-consumer Fortnite has ever been?,4046,518,2025-12-26,"First and most obvious, sidekicks, the worst cosmetic ever. No one except you and your teammates can see them, and you have to buy each variant separately, because the style you choose is locked forever.  Then they made the battle pass a nightmare to unlock. Not only is getting XP hard af, but you also have to play specific modes and do very specific quests. Also, you can't unlock the OG pass completely, because half of it requires you to wait a whole month to even start unlocking it.  And now it continues with Winterfest requiring you to log in every single day, because if you miss even one day, you can no longer claim all presents.  What is up with all companies this year? Everyone wants to f you over more than ever it seems.",https://www.reddit.com/gallery/1pvjgcf
Microtransaction,"I thought I was a ""Free to Play"" player until I audited my microtransactions.",1065,432,2025-12-26,"I play a lot of Valorant and a few gacha games on mobile. I always tell myself I don't spend money on games, maybe just the occasional battle pass or a skin if it’s cool.  I decided to clean up my finances recently because I want to buy a new GPU. I used MoneyGPT tracker tool to scan my transaction history for ""Entertainment/Gaming.""  I almost threw up.  In 2024 alone, I spent $1,400 on ""micro"" transactions.  $10 here for a skin. $5 there for a bundle. $20 for currency.  It’s actually terrifying how invisible these purchases are. They don't feel like ""real money"" when you are clicking a button for digital coins. But looking at the aggregate total, that is literally the price of a 4080 Super that I claimed I couldn't afford.  I locked my cards on the app stores today. If you think you aren't a ""whale,"" check your history. You might be surprised how much those $5 charges add up.",https://www.reddit.com/r/truegaming/comments/1pvhz32/i_thought_i_was_a_free_to_play_player_until_i/
Competitor,My biggest competitor reached out to acquire me. The conversation taught me more about my business than 3 years of running it.,1322,195,2025-12-25,"Got an email a few months ago. The CEO of my biggest competitor wanted to chat. Assumed it was a trick or a scouting mission. Took the call anyway out of curiosity. They wanted to buy me. Real offer. Real number. Not life-changing money but meaningful. I didn't take it. But the process of considering it taught me a ton. They asked questions I'd never asked myself. What percentage of customers actually use the core feature? What's the real competitive moat? How replaceable am I personally to the business? What would break if I disappeared? What assets transfer versus what's just me? Had to actually find the answers. Some were uncomfortable. The moat I thought existed basically didn't. Turns out competitors could rebuild my product in 3-4 months. The thing I thought was defensible was just a head start. My personal involvement was more central than I'd admitted. Relationships I had with key customers, knowledge in my head, reputation I'd built. The business without me was worth a lot less than I assumed. But I also discovered strengths I'd undersold. Customer retention was higher than I realized. A segment I thought was small was actually growing fast. The word of mouth in a specific niche was stronger than any marketing I'd done. The acquisition didn't happen but the clarity was worth more than the offer. Highly recommend pretending someone wants to buy you and asking yourself the hard questions. You'll learn a lot. What would you discover if someone tried to acquire you?",https://www.reddit.com/r/SaaS/comments/1puxm4i/my_biggest_competitor_reached_out_to_acquire_me/
PoE,Should I try POE 1?,246,233,2025-12-25,"I have played poe1, from what I remember for an hour in total. Poe2 on the other hand I have hundreds of hours and right now, as we know there’s hardly an endgame till 0.5. I played this new league, got to endgame, have 100 divines and not an upgrade to buy for myself, so I was looking into poe1 and wondering if it’s worth getting into a bit?  Edit: you guys have convinced me! Thank you boys and see you there!!",https://www.reddit.com/r/pathofexile/comments/1pv8ej0/should_i_try_poe_1/
Paladin,Paladin has almost ruined other classes for me,291,294,2025-12-25,Ever since running Arbiter and being able to be at max movement speed without much investment trying to play alts has been brutal. I’ve only managed to do it because i found an heir of perdition and Tyraels might.   Rogue has been dance of knives and Druid has been cataclysm just fun to be fast n mobile. Anyone else having this problem? ,https://www.reddit.com/r/diablo4/comments/1puqskw/paladin_has_almost_ruined_other_classes_for_me/
Spiritborn,Is the Spiritborn Class Washed?,0,24,2025-12-25,"No matter what build I try, I can't do any sort of content on my SB; I've tried builds from Icy Veins, Mobalytics and Maxroll, and - especially compared to Paladin - my SB hits like a wet noodle. I can't even do LAIR BOSSES on him, for god's sake...",https://www.reddit.com/r/diablo4/comments/1pv0hl0/is_the_spiritborn_class_washed/
Paladin,Just KOed all of the Tieflings during my good Paladin HM run,2984,202,2025-12-24,"* Talked to Mattis    * Here we go again * Didn't pass the perception test this time * *Your bag feels lighter* * ""I believe you have something that belongs to me"" * ""Go talk to Mol about it"" * Fine * *Enters the hideout* * *Mol starts counting down* * Give me back my items, child * ""Ok, you did this to yourself"" *tells an adult I was threatening a child* * Guex tries to apprehend me * ""Bribe, surrender, or attack"" * Not giving me, an adult, due process? What kind of camp is this? Cowabunga it is... * *Continues to bonk every adult tiefling who joins (non-leathal)* * You did this to yourself... * Wish Lae'zel was here, she would've approved for once lol",https://i.redd.it/81ide9m6p09g1.png
Season 11,"Sophemore season with the Bears. Caleb Williams: 11-4, 3791 total yards, 27 total TDs. Mitch Trubisky: 11-3, 3644 total yards, 27 total TDs.",1835,398,2025-12-24,Still can't believe how good Matt Nagy made Trubisky look that year. ,https://www.reddit.com/r/nfl/comments/1pu6h7j/sophemore_season_with_the_bears_caleb_williams/
Paladin,AURADIN: Every Question Answered - Between Genius and Laziness of the Holy Light Aura Paladin,1371,294,2025-12-24,"You have questions about Auradin? As an early christmas present, I have compiled all the answers for you.  I am sure many of you have asked themselves whether to use Herald of Zakarum, why Preacher is so good all of a sudden and if you actually need Hands to play this Build. I've received a ton of questions from the community and answered them as thoroughly as possible, based on my testing and expertise of the build. The most frequented question I see around this subreddit and other places, is how Holy Light Aura even works, so let's begin there:  **Holy Light Aura Mechanics**  TL;DR: Stack Attack Speed and use the Ceh Runes that spawns Wolves  * Holy Light Aura scales its damage linearly with Attack Speed, that is why we are stacking it. * Aura Potency from Sundered Night or other sources act as a direct damage multiplier. * Holy Light Aura emanates from all your allies, so each of your Ceh-Rune Wolves, replicate it. Your Mercenary does too. * Dawnfire deals Fire damage and benefits from +Ranks to Holy Light Aura and its Potency. * Dawnfire replaces your own Holy Light Aura, but your allies keep emanating it. * Dawnfire inherits most bonuses from Holy Light Aura, such as the Judicator Tag. * Dawnfire benefits from Aspect of Proselytizing  **What do the wolves even do?**  * They chill enemies they hit - being able to freeze them at multiple consequent hits. * They do apply vulnerable to the target they hit, but it is not consistent enough to not use an affix on the ring dedicated to it, because a lot of our multipliers depend on the enemy being vulnerable.  **Why are we using Preacher Paragon Board?**  TL;DR: It's much more damage.  Preacher's tooltip (as unfortunately so many in Diablo 4) is misleading and it actually gives much more damage than the description might insinuate.  The Damage Formula for Preacher is:      1 + (0.65 * [1 + Sum of Attack Speed])  Without any Attack Speed, this results in:      1 + (0.65 * [1 + 0]) = 1.65 =&gt; 65%[x] multiplier.  At 100",https://www.reddit.com/r/diablo4/comments/1ptznj3/auradin_every_question_answered_between_genius/
Shop,Shopping w/Gray jogging pants.,6366,337,2025-12-24,,https://i.redd.it/3inp7u68509g1.jpeg
Shop,Where did these two get money for a shopping spree?,7968,522,2025-12-24,,https://i.redd.it/pmjytiq3w49g1.jpeg
Rubberbanding,Extreme lagging and rubberbanding since the December 18th patch.,13,25,2025-12-24,"Have been experiencing ""rubberbanding"" lag since Friday (Dec 19), to a degree it makes the game unplayable.      Have already: reset my router; went through the connection troubleshooting in the support page; verified files on Steam; reinstalled on Steam; cleared shader caches. None of it worked.      Played the game fine since launch (around 100 hours on it), including after the Cold Snap Update. Other games are fine, as is my overall internet connection outside of Arc Raiders (ping test pages show my ping to be somewhere between 20 and 35). I'm thinking it's an issue on Arc Raider's end, and not on my connection. Also, pretty sure it's not graphics or hardware related.  Has anyone been experiencing this? Any tips?  **TL;DR: Extreme lag since the December 18 patch, my connection outside of the game is fine.**",https://v.redd.it/yhlr8lb4w19g1
Season 11,"This season teams are 2-11-1 the week after playing the Bears, 0-5-1 after playing in Chicago, and 0-9-1 after losing to the Bears. In Detroit they called it ""The Honolulu Flu"". What are we calling it? ""Chicagovid-18""? ""TuBearculosis""?",1086,129,2025-12-24,,https://i.redd.it/dvlvxbvov39g1.jpeg
Unique,"The Tepepolco volcano in Mexico City. Dormant for over 10,000 years, its crater is now a unique residential neighborhood.",38707,783,2025-12-24,,https://i.redd.it/kpn5tdlzc29g1.jpeg
Buff,A flag buff would ruin immersion! Meanwhile...,4889,221,2025-12-24,I've had stratagems bounce all the time but this one was particularly egregious. ,https://v.redd.it/h6p5egrjdz8g1
Rubberbanding,Awesome Rubberband,1890,59,2025-12-24,,https://v.redd.it/n0sko1t0219g1
Microtransaction,"&gt;Multiplayer game,still without: loot boxes, seasons pass, or microtransactions; FromGod remains untouched.",2101,269,2025-12-24,,https://i.redd.it/3m9d8pkq959g1.jpeg
Spiritborn,Struggling with Spiritborn and the damage output.,2,8,2025-12-24,"I'm struggling with the spiritborn class, I'm paragon 229 and struggling to kill things especially in the pit, I can solo up to 50 but I can't seem to put out the damage other spiritborn of my level does. All my glyphs are currently 65.  What are some things I can try to do to improve.  I've followed the paragon board guide online and have all the right gear.  My damage is 702 and armour is around 80k.  Is there a differenxe between damage output on an Xbox than PC?  What are some typical stats for an end game spiritborn class. ",https://www.reddit.com/r/diablo4/comments/1pukbj5/struggling_with_spiritborn_and_the_damage_output/
Crash,Idiot driver gives an honest explanation for crash.,6315,755,2025-12-23,,https://v.redd.it/k3gy7xwuyu8g1
Crash,"Vince Zampella, video game developer behind ‘Call of Duty' franchise, killed in crash",16788,1612,2025-12-23,,https://nbclosangeles.app.link/ybo9MkJvjZb
Sorcerer,FOR ALL YUTA HATERS !!yuta without rika is weakest sorcerer ? That's his powers,1130,138,2025-12-23, ,https://i.redd.it/8ivvunlakx8g1.jpeg
Battle Pass,Can't wait for the minecraft battle pass,12172,279,2025-12-23,,https://i.redd.it/dd7znqr2tt8g1.jpeg
