keyword,title,score,comments,date,text,url
Rubberbanding,Has the rubberbanding that's been happening for the last couple days been fixed?,2,13,2026-01-29,I wanted to get on and play for a bit today but I was seeing alot of posts about people dying in stupid ways because they couldn't move because the rubberbanding was so bad. I don't want to get on if it hasn't been fixed yet. Anybody know if it's still a problem or not? ,https://www.reddit.com/r/ArcRaiders/comments/1qpksr6/has_the_rubberbanding_thats_been_happening_for/
Competitor,Tesla hits a grim milestone: its second straight year of losses / The automaker has lost the lead to its Chinese competitors as its business continues to contract.,5739,437,2026-01-29,,https://www.theverge.com/transportation/869603/tesla-q4-2025-earnings-revenue-profit-musk-robotaxis
Spiritborn,Spiritborn: Minimum ferocity bugged,7,1,2026-01-29,"https://preview.redd.it/v9o0gwe625gg1.png?width=1992&amp;format=png&amp;auto=webp&amp;s=6c46bad2f60b161a9b7e845c3af908405ac927aa  Apparantly when using harmony of Ebewaka, seems like + gorilla skills of hesha e kesungi doesn't apply correctly to ravager when using gorilla as second spirit (it works for gorilla as first spirit). The skill is clearly marked as Gorilla but minimum ferocity is 2 while tooltip says 5.. Adding 1 skillpoint combat fixes the problem but this ofc isn't possible in pit/tower. Seems like another weird snapshotting bug.",https://www.reddit.com/r/diablo4/comments/1qpkvsc/spiritborn_minimum_ferocity_bugged/
Shop,No Work! No School! NO Shopping! No ICE!!,13547,1217,2026-01-28,,https://i.redd.it/g7oxp0tbvwfg1.jpeg
Loot,EMBARK BETTER GAVE MY LOOT BACK,3129,374,2026-01-28,This is how all of you who are expecting reimbursement sound ,https://i.redd.it/7day5qco63gg1.jpeg
Rubberbanding,Am I the only having extrem lags and rubberbanding every day around 6 - 10pm or are still this many people playing that the servers are constantly overloaded?,6,16,2026-01-28,"Playing during the day is fine, but once we hit prime gaming hours the server shit the bed. Extreme rubberbanding, zooming, lags etc. Really taking the fun out of the game.       Please GGG invest in better servers or never make this game f2p  Rant over, thanks ",https://www.reddit.com/r/PathOfExile2/comments/1qol3gd/am_i_the_only_having_extrem_lags_and/
Unique,"When DH released, both Havoc and Vengeance were given their own unique Metamorphosis form. I hate that Devourer is so overally underbaked that it's legit just re-cycling Havoc form (the most popular) by painting it blue. Devourer needs its own Metamorphosis form.",1925,481,2026-01-28,"Man, Devourer should be the strongest expansion selling point and it just feels like a high school kid modded a private server and recolored some assets --including Void Elf DH features (let's not even go down that tangent).  ^(Personally I think they should lean towards a more iconic and pure Void creature rather than a Demon.)  ^(OG DHs Meta-forms are demonic because they consumed the heart of a Demon and take on their forms to fight other Demons.)  ^(Devourers take on the Void to fight the Void, so they can't just fight as Demons. It makes little sense, and their bulky/physical form clashes a lot with their range/caster identity.)  ^(Honestly I think they should go for something like an Ascended Voidwraith, but at the end of it I don't care AS LONG AS THEY JUST DON'T RECYCLE HAVOC'S FORM.)",https://i.redd.it/pzjpq4hrh2gg1.png
Rubberbanding,"Connecting takes several minutes or more after patch, to join a unplayable rubberbanding server.",6,21,2026-01-28,"EDIT: EMBARK get attacked by DDOS. The Finals and Arc Raiders server had problems. Look like its fixed now, hotfix patch.  Connecting takes several minutes or more after patch, to join a unplayable rubberbanding server. I waste 12 Hatchkeys yesterday until now. And sometimes its not possible to reah the hatch and i die to arcs they do not rubberband. I lost a lot of loot, hatch keys, time and in the end fun. This only happens if i join as duo or trio it happen all the time.  Connecting solo runs fine. Hope for a fast fix, help us Embark your patch broke serverperformance.",https://www.reddit.com/r/ArcRaiders/comments/1qp86nt/connecting_takes_several_minutes_or_more_after/
Crash,"[Highlight] SGA elbows Herb Jones in the head, crashes to the ground and gets called for a technical for flailing",4019,599,2026-01-28,,https://streamable.com/gbhtxf
Barbarian,"We are going to build a grand Formation, and we will make the northern barbarians pay for it",1294,61,2026-01-28,,https://i.redd.it/bedkq9psjxfg1.png
Barbarian,"Screw it, buff the barbarian a ton",1134,51,2026-01-28,"Pretty much an after thought, only used if you have one troop space left over.  Come on Supercell, give this guy like 50% more damage, let it be able to tank a scattershot, and it will at least be usable.",https://i.redd.it/o98nto0orzfg1.jpeg
Unique,Unique spins on very common powers,9207,1175,2026-01-28,"Brit-Image Comics/Invincible   Invulnerability is a very basic power. However what makes Brit unique is that it’s his only power, he’s just a guy you can’t hurt. No super strength or anything   Top - Undead/Unluck  His ability is called Unstoppable. He’s a basic speedster but the unique thing is that he can’t stop without crashing into something  Pyro-X-men/Marvel   Fire manipulation but he can’t create fire, needing nearby sources for it   Triton-Inhumans/Marvel  There’s always an Aqua-guy on super teams. But Triton is unique since he’s not amphibious, he can’t breath air and will die if he’s outside of water for more than 5 minutes  Mirio-MHA. Quite a few of people who can walk through walls but Mirio “Permeation” is unique. Everything phases through him, air, sound, light (so he’s blind, deaf, and can’t breathe) but he can also get flung out of objects if he’s mid-phase between them   Bushmaster - The boys.   She can control her hair but uh…only a specific kind of hair   Mr. Immortal - Marvel   He’s fully immortal but has no sort of healing factor and is very much no invulnerable. Just whenever he dies he gets back up after a few seconds    ",https://www.reddit.com/gallery/1qowf2r
Loot,PSA: Do NOT go into raids right now. Servers are messed up and it's basically impossible to move. You will lose your loot!,1263,453,2026-01-28,Embark already warned players to not login previously. Servers are having a lot of issues right now,https://www.reddit.com/r/ArcRaiders/comments/1qp86xy/psa_do_not_go_into_raids_right_now_servers_are/
Sorcerer,What if Devil Hunters and Jujutsu Sorcerers switched places in Japan?,1765,103,2026-01-28,,https://i.redd.it/73n1evuk9yfg1.jpeg
Loot,Decreasing the loot speed was intended,1738,733,2026-01-28,Even though they said earlier in the discord chat that it was “unintended and the team was aware of the issue” they have now updated the official game announcement on discord saying it was an intended change.,https://i.redd.it/vtu3jvn4r3gg1.jpeg
Uber Unique,"(Standard) Want to see Affliction-level big drops (raw divs, t0 uniques, t0 scarabs), should I invest into MF or invest into a uber strong build?",0,3,2026-01-28,,/r/pathofexile/comments/1qolf91/standard_want_to_see_afflictionlevel_big_drops/
Uber Unique,"(Standard) Want to see Affliction-level big drops (raw divs, t0 uniques, t0 scarabs), should I invest into MF or invest into a uber strong build?",5,7,2026-01-28,"I miss the **crazy raw div, t0 uniques, t0 scarabs drops in Affliction league**. Came back to Standard and see what I can do to enable the same crazy level of looting.  This is what I currently have in Standard:  \- \~5 mirrors  \- Some legacy IIQ items (+20 IIQ amulet, full stat legacy Ventor, IIQ gem, legacy Divination Distillate flask).  \- Some legacy items (melding, adorned, settler weapons)  I am deciding between   1)  a new MF build with the currency and legacy gears I already have, OR   2) a uber strong build that can do super juiced maps.  **For MF build**: I have done the research over the years, 5 mirrors are on the low end of MF investment. That being said, I am okay not doing most juiced content, as long as it gives the same crazy drops. The thing with standard is that there are OP builds that don't cost a fortune due to legacy interactions, like settler weapons, legacy harvest gears, infinite vaal, i.e. the broken stuff. Let me know if there is anything i can try putting together within 5 mirrors with the IIQ gears I already have (the 3 jewellery slots). I have tried TS/LS Deadeye, ESoH Warden, not using the 3 jewellery slots are build-breaking for me as it doesn't survive a sneeze from white mobs in T16.   \- If i were to take this route, what maps should I be running to see good drops?  **For uber strong build**: I have a few uber strong builds that can breeze through deli t17, insta phase uber bosses. My most powerful build is a MSoZ Jugg, but it's impossible to use any MF stuff without breaking the build except a flask spot which i used a wine of the prophet. I have been doing titanic blight, deli t17, haven't seen a t0 drops, occasionally a div. I am fairly certain i didn't juice my map correctly.   \- If i were to take this route, how can i juice it to the highest level possible?",https://www.reddit.com/r/pathofexile/comments/1qolf91/standard_want_to_see_afflictionlevel_big_drops/
Nerf,They Nerfed Stegull,9944,523,2026-01-28,,https://i.redd.it/kkpna170ixfg1.png
Endgame,18/m Capsule [A] &amp; 18/m HC Battery Endgame CN Build Recreation for NA/EU,2888,444,2026-01-28,"I recreated the CN build that you might have seen floating around, for NA/EU users.   Uses Core AIC and all Sub-PAC's.   Core AIC needs to be fully upgraded and expanded with all busses.   Sub-PAC's need 4 busses.   Recommended to only build once you have region level 11, and all mining nodes powered.   Requires you to place plants into seeders.  Core AIC:  1. Top Left - EFO01iOe7u5E0O2472U4 2. Bottom Left - EFO01Iao8U10Oa905o08 3. Mid Top - EFO012I450uoiI8EeIOo 4. Mid Bottom - EFO01893ui06291oUi73 5. Top Right - EFO010U9657AuUiiE179 6. Bottom Right - EFO011ea02i78eU134O7  Sub-PAC Outposts:   Outpost x3 - EFO019A61OUiIAeI5uI2  Edit: Made edit to ""3. Mid Top"", to fix originium yield to usage rate, should now read current data of 560/560.   Thanks to [Kanadeai](https://www.reddit.com/user/Kanadeai/) for pointing this out.",https://www.reddit.com/gallery/1qosom1
Price,Anybody Ever Have The Fisher Price Toy Barns That Make The Moo Sound When You Open The Door?,9075,295,2026-01-28,,https://i.redd.it/fuj0yt3y20gg1.jpeg
Rogue,coaxed into a rogue like,5913,280,2026-01-28,,https://i.redd.it/fk6979z9nxfg1.png
Queue,Y'all will look at teams lock in as this and stick that way and still act confused when some of us say we would like a role queue option,1914,574,2026-01-28,"Like what the fuck. This was in comp and the only one who swapped was me, to support and TRY to coax someone to join me so we at least had 2 healers.  How are people doing this shit in PLAT lobbies. The training wheels are off by that point and still you get this bs",https://i.redd.it/26lxu9rg3yfg1.png
Shop,Went shopping at Walmart and my husband sends me this... again,4049,430,2026-01-28,we went to Walmart and I'm in the grocery section and he send me this... again. he found one a month ago(I did a previous post on it) .  Well this one is a little more expensive than the last one and its clearly used. Is this one a good gamble? the associate said we can return it if we have problems.  ,https://www.reddit.com/gallery/1qoqbhe
Loot,New Looting MK. 3 (Safekeeper) Augment,3336,877,2026-01-27,,https://i.redd.it/3gv22ld7gvfg1.png
Disconnect,(Spoilers Extended) The disconnect between GRRM’s Sansa and the Sansa we read,424,255,2026-01-27,"So it's no secret that the series was originally meant to cover far more time than it ultimately did. I won’t bring up the five-year gap since that’s been done to death but I think it's worth stressing that the gap was a late solution GRRM only arrived at it after realizing his approach wasn’t working.  &gt; GRRM: **Originally, there was not supposed to be any gap. There was just supposed to be a passage of time, as the book went forward.**  &gt; **My original concept back in 1991 was, I would start with these characters as children, and they would get older. If you pick up Arya at eight, the second chapter would be a couple months later, and she would be eight and a half and then she'd be nine. This would happen all within the space of a book. But when I actually got into writing them, the events have a certain momentum. So you write a chapter and then in your next chapter, it can't be six months later, because something's going to happen the next day. So you have to write what happens the next day, and then you have to write what happens the week after that. And the news gets to some other place. And pretty soon, you've written hundreds of pages and a week has passed, instead of the six months, or the year, that you wanted to pass. So you end a book, and you've had a tremendous amount of events — but they've taken place over a short time frame and the eight-year-old kid is still eight years old.**  What I want to discuss is how this failure to meaningfully age the characters changes the context in which their actions are read, especially Sansa’s.  Sansa’s culpability in Ned’s downfall has always been contentious. GRRM has repeatedly stated that she bears real responsibility (though not all her fault), and the text itself backs this up via Cersei. Yet many readers are understandably deeply uncomfortable with this framing, because Sansa is **11 years old**, and assigning blame to a child in an extremely stressful situation feels cruel.  &gt;**""Littlefinger made the ",https://www.reddit.com/r/asoiaf/comments/1qoayy4/spoilers_extended_the_disconnect_between_grrms/
Unique,Baby I saved from the cold with a unique lil paw 💗,16796,349,2026-01-27,Her name is Flip. I won the cat distribution lottery!!,https://www.reddit.com/gallery/1qnvpgk
Queue,does anyone having Queue problems or is it only me?,10,10,2026-01-27,,https://www.reddit.com/r/DeadlockTheGame/comments/1qnvlky/does_anyone_having_queue_problems_or_is_it_only_me/
Unique,Let's get jiggy with it! Memorable and unique dances,3912,917,2026-01-27,Torture Dance (Jojo's)  Reze Dance (Chainsaw Man)  Toothless Dance (Cas van Pol),https://www.reddit.com/gallery/1qnrok5
Queue,Log in queue is taking forever heads up,6,17,2026-01-27,,https://www.reddit.com/r/HighGuardgame/comments/1qno0qg/log_in_queue_is_taking_forever_heads_up/
Queue,Infinite Queues,7,7,2026-01-27,"Cannot get into a game ever since Rem released, tried for the past 40 mins.  Anyone else have this problem/have a solution?",https://www.reddit.com/r/DeadlockTheGame/comments/1qnvj3b/infinite_queues/
Rubberbanding,Crazy lag/rubberbanding issues since the latest update,11,8,2026-01-27,"I was having this issue on Buried city before this round but managed to extract. I checked my latency and it was 15ms so i thought okay it should be fine now.  I load up Dam, and i get stuck in the loading screen for 15 mins so I join with only 15 mins left in the game. Okay cool whatever I thought, then this lag starts happening again and I get downed.   Luckily, there was another raider nearby who had a defib. I told him i was lagging like crazy and he said the same thing was happening to him and that he also was stuck in loading screen for 15 mins. He also said he had to save someone in another game where they were lagging like crazy.  Devs, please prioritise this issue. I nearly lost an 108k loadout.",https://v.redd.it/w0qld8zkdwfg1
Drop rate,StatCan survey examines why Canada’s fertility rate keeps dropping,423,703,2026-01-27,,https://www.cp24.com/news/canada/2026/01/26/statcan-survey-examines-why-canadas-fertility-rate-keeps-dropping/
Necromancer,"#ArcaneApprentice Sam the Paleo-Necromancer, apprentice to the Grand Curator",838,34,2026-01-27,,https://www.reddit.com/gallery/1qnm1zl
Battle Pass,"Mick Foley on Instagram: ""GOODBYE MOM It is with a heavy heart I report the passing of my mother, following a lengthy battle with dementia.""",4179,85,2026-01-27,,https://www.instagram.com/realmickfoley/p/DT-wSsgDY2o/?hl=en
Competitor,"Toyota just teased its Maverick competitor, will prices finally come back down?",412,209,2026-01-27,,https://i.redd.it/z7cu3549nwfg1.jpeg
Sorcerer,Are all sorcerers kitchen knife victims without ce reinforcement like Naoya?,5484,397,2026-01-27,I've been wondering how he got killed by a non sorcerer,https://i.redd.it/bqpfzevlppfg1.jpeg
Competitor,"Tom Petersen: Intel has no plans for Strix Halo competitor, says AMD iGPU tech is “not that competitive”",307,293,2026-01-27,,https://www.club386.com/intel-no-plans-amd-strix-halo/
Patch,"Here we go slient nerfs , not mentioned in the patch notes",2251,981,2026-01-27,https://preview.redd.it/35oknfsktvfg1.png?width=884&amp;format=png&amp;auto=webp&amp;s=c7b7a28c2cc2c508b13c4eff8b53f485891deb6d  ,https://www.reddit.com/r/ArcRaiders/comments/1qobyp9/here_we_go_slient_nerfs_not_mentioned_in_the/
Patch,Update 1.13.0 Patch Notes,1629,966,2026-01-27,,https://arcraiders.com/news/patch-notes-1-13-0
Lag,"Lag gye h bhai, paper k pehle hi sb kuch ho rha, bhut weird chiz hui kal",787,163,2026-01-27,"I’m a student. Yesterday I decided to pull an all-nighter as my exams are near. I was sitting at my study table when I felt as if someone was behind me. I took a glance back multiple times, but no one was there.  Then after a few minutes, my study table turned dark. I couldn’t even read what was written on my register because it was too dark. There wasn’t any light falling on it even though the entire room was perfectly lit up. There wasn’t any problem with my vision, as I was able to read everything written on the sheets pasted on the wall in front of me.  I felt as if something huge was standing behind me. To confirm, I turned right to see the LED bulb, but it was working completely fine. My table was also now lit up perfectly. But then again, after a few seconds, the table went dark.  I screamed too hard to call my mother. When she came into the room, the table went back to normal lighting.  I’m too much scared right now, unable to study. I’m damn sure it wasn’t some lighting issue or my vision-related issue. I felt as if someone was standing behind me.  posted it on r/ParanormalEncounters",https://i.redd.it/poyfjw4ybtfg1.jpeg
Buff,"Never fight demons without the ""post nut clarity"" buff",7597,98,2026-01-27,,https://i.redd.it/8aq3k1oc0sfg1.jpeg
Disconnect,"If your enemies keeps disconnecting in glowbert event, just remember this may be the situation they are in",2280,80,2026-01-26,I left the game just to post this  thank god leaving without picking doesn't consume any tickets ,https://i.redd.it/0echr44y9ofg1.jpeg
Patch,Alex Pretti's executioner wearing a Texas flag patch on his back.,71922,2180,2026-01-26,,https://i.redd.it/m5pt447rdkfg1.jpeg
Patch,Windows 11’s Patch Tuesday nightmare gets worse — Microsoft says some PCs might not boot,2569,391,2026-01-26,,https://www.windowscentral.com/microsoft/windows-11/windows-11s-botched-patch-tuesday-update-nightmare-continues-as-microsoft-confirms-some-pcs-might-fail-to-boot
Patch,Microsoft issues SECOND emergency out of band update for Windows 11 to address disastrous Patch Tuesday bugs — KB5078127 released globally,2563,312,2026-01-26,,https://www.windowscentral.com/microsoft/windows-11/windows-11-second-emergency-out-of-band-update-kb5078127-released-address-outlook-bugs
Paladin,My party's paladin and bardlock (they both have an int. of 8),4893,182,2026-01-26,,https://i.redd.it/91x24ubc3nfg1.jpeg
Nerf,Riot Phreak says that Dusk and Dawn shouldn't get nerfed and that it is in a perfectly good state,1387,949,2026-01-26,Source: [https://www.youtube.com/shorts/yujME2dV3uI](https://www.youtube.com/shorts/yujME2dV3uI),https://v.redd.it/28riimnhmifg1
Rubberbanding,PC players should ideally be prioritized as hosts,795,203,2026-01-26,"Disclaimer: I apologize for the long post, it's just been on my mind for a few weeks at this point since issues have been more common. Head over to **""The actual issue""** for main content.  &amp;nbsp;  **Most important edit**: **this post is NOT meant to encourage the dropping of support for old-gen consoles**. It is meant to hopefully appear on DE's radar so that at *least* matchmaking, but also optimization, is looked at for older-gen consoles. This is not some ""ooga booga PC master race"" post like some of y'all assume from the title alone. Read the **post and comments**, damn it. Literacy can *not* be this low.  **Edit**: I don't want to shaft console players. This is a discussion about theoretical solutions without either discontinuing older console support, nor adversely limiting their player pool as opposed to PC players. It's about finding a balance and a better matching system.  **Edit 2**: I have been informed that a lot of the issues are due to the CPUs of older consoles as opposed to actual networking hardware. This is good to know but doesn't really change the crux of the post, unfortunately.  **Edit 3**: No, disabling cross-platform play does not fix this, since that puts me with other people who have it specifically disabled, which shrinks the possible pool of players for you, instead of giving you a better client experience. It's virtually impossible to get a 4-man random pub squad for a fissure this way after a dozen attempts. This option would be great if it worked off existing lobbies and simply checked whether the current people are PC or not, as opposed to *only* checking whether the person also has crossplay disabled.  **Edit ∞**: formatting.  # The actual issue  I've been playing for a while, about 3000 hours almost at this point, and I've been mentally logging every time there are connection issues that negatively impact the mission. Almost every time, without fail, it's a console host. Sometimes it's fairly innocuous like doors opening a litt",https://www.reddit.com/r/Warframe/comments/1qncwsy/pc_players_should_ideally_be_prioritized_as_hosts/
Lag,Why india is lagging behind,3123,125,2026-01-26,,https://v.redd.it/8kbe9v49imfg1
Crash,Pilot has managed to land plane without crashing after the front wheels failed.,30425,805,2026-01-26,,https://v.redd.it/fsd2fm4e9kfg1
Rubberbanding,Anyone else experiencing massive rubberbanding on missions sometimes?,3,10,2026-01-26,"I'm in oceania and I've been having this issue occasionally for the past few weeks where I will queue up for a quickplay and I never get put into a lobby with other players even when the hub has a decent amount of people and there are people online. Additionally, when the mission does start, no one ever seems to join and replace bots, and I have this insane rubberbanding problem that makes it literally unplayable.  I thought it might just be my connection issues, but a friend had a similar problem that he seemed to have fixed with a reinstall, so I know it's not just me. i tried a reinstall but I'm now having that problem with every mission I try to get into.  There is no rubberbanding issue in hub, only on missions.  No teammates, massive rubber banding, then I quite the game because it's unplayable. It even happened when I queued with that friend in my strike team even though he wasn't experiencing the problem anymore.  I have fallen in love with this game since I started playing during the hive scum release weekend, and I really want to get this fixed so I can keep enjoying it!  It's now every time I try, not just occasionally :(",https://www.reddit.com/r/DarkTide/comments/1qnbm70/anyone_else_experiencing_massive_rubberbanding_on/
Crash,"Private jet carrying 8 people crashes at Bangor, Maine, airport, source says",13421,994,2026-01-26,,https://www.cnn.com/2026/01/25/us/bangor-maine-plane-crash
Crash,"Reports of a Bombardier Challenger crash on takeoff at Bangor, Maine",9938,1032,2026-01-26,,https://i.redd.it/0gr941gkklfg1.jpeg
Rubberbanding,What is up with the crazy rubberbanding recently?,137,36,2026-01-26,"You could argue this is a skill issue, maybe I didn't have to jump off the rock, but I probably could have gotten away if I didn't teleport back by like 2 meters. ",https://v.redd.it/6uru0c07rofg1
Queue,"If everyone complains about triple support, lack of flex players, ect, why do you hate role queue?",285,635,2026-01-26,"I understand people like open queue because it allows for flexibility, and even i enjoy it too sometimes as when i feel im not doing enough on dps, i go rogue.   But it seems like triple support has been an ongoing issue since the games release that even the devs have acknowledged but still fail to balance.  People complain about the excessive amount of dps players who wont swap and how tanks are often left to solo tank. ALL of this gets fixed with role queue.  So, despite your criticisms for these things, what makes object against role queue?",https://i.redd.it/75fa6cnnhnfg1.jpeg
